id,text,label,dataset,text_en
yt_1678,"सत्य तथ्य पत्ता लगायेर गल्ती गरे को पाइये मा , जो कसैलाइ पनि कार्बाही हुनुपर्छ ।",0,youtube,"Find the truth and find the wrong person, which should be a duty on anyone."
yt_422,जाबो एउ टा video को बारे मा जवाफ दिन नसक्ने dig चोर साले !,1,youtube,You are a thief who cannot answer a question about a video!
yt_562,सबै चोर हुन अनि जनता धेरै माहाचोर हुन साला दिमाग नभा का जनता को यहि हाल हो हुने ।,0,youtube,"This is what happens to the people of the minds of the poor, even if they are all thieves and the people are very clever."
yt_1019,बुढा लाई मारेर खाइस अहिले रास्ट्रपति लाज छैन ।,1,youtube,The old man who had killed and eaten the old man is no longer President Shash.
yt_1296,"धमला बोल्न देउ न बौद्धिक डा , आचार्य लाई प्वाक प्वाक नबोल ।",1,youtube,"Do not let the intellectual Dr. Dhamala speak , the Acharya lay Pwak Pwak Nabol ."
yt_486,सागर सर तपाई मा देखिएकाे राष्ट्रभक्ति लाई सलाम छ ।,0,youtube,"Sir Sagar, you salute the nationalism you have shown."
yt_1336,हरेक मिडिया ले खुलेरै राजा को बारे मा समाचार सम्प्रेषण गर्नुपर्यो !,0,youtube,Every media outlet should be free to broadcast news about the king!
yt_55,राजा अाउ देस बचाउ ।,0,youtube,Save the king and his country.
yt_758,"त्यो बलात्कारी बाउ को छोरो कता गयो मुजि , रबि दाजु हिरासत मा हुदा खुब 10 लाख माग्यो भनेर आरोप लगाईरा को थियो रण्डि को छोरो ।",1,youtube,"The son of the rapist Baou Muji, Rabi Daju in custody, was accused of demanding Rs 10 lakh from the government."
yt_906,अनुहार हेर्दा ठमेल को भालू हो यो आइमै ।,1,youtube,Looking at the face of the bear is a trick.
yt_488,हो यो होनि त तरिका गरे के हुँदैन र ।,0,youtube,"If this were to happen, it would be wrong to do so."
yt_1566,धेरै धेरै शुभकामना र निरन्तर एक पाइला पछि नपरी अगाडि बर्दै जानू होल न्याय को पछे मा. ... ।,0,youtube,"Best wishes and continuous, continuous, continuous progress in the face of justice behind the law."
yt_1314,अरु को तारिफ गर्ने अाले जि अाफ्नाे देश को भ्रष्टाचारि पाखा लगाउनुस अाजिवन राजनीति मा बन्देज लगाउनुस ।,0,youtube,Praise others who have banned corruption in your country and banned it from politics.
yt_1207,कांग्रेस र कम्युनिष्ट नाम का यि लुटेरा हरु लाई जतिसक्दो छिटो लखेटनु पर्यो ।,1,youtube,"These robbers, known as Congress and Communists, had to be caught as quickly as possible."
yt_768,"PHD वाला नेता रे छि छि छि छि लाज लाग्नु पर्ने , एउटा प्रश्न को उत्तर दिन ३ पटक सोध्दा त कुरा अर्को तिर मोडछ यस्तो खाते नेता लाई अब कहिले नबोलाउनु होला !",0,youtube,"A leader with a PhD is a shameful person, if you answer a question three times a day, the conversation turns to the other side."
yt_539,साला कुत्ता थग हरुलाइ छोद नु हुदैन एउटा गरिब जनता ले दुई चार सय रुपया नतिर्दा लाइन कात्ने अर्बौं रुपिया नतिर्ने साला कुत्ता हरु यस्ता कुत्ता हरुलाइ नछोद्नु कुल मान सर ।,0,youtube,"A poor people don't have to pay two hundred rupees to the poor, cut a line of two hundred thousand rupees to the poor, and don't give up such dogs."
yt_199,जस ले मात्र पिडित नेपाली लाई न्याय निसाफ दिइ रहे का छन त्यो युग पुरुष रबि हो ।,0,youtube,The only time the suffering Nepalese has been given justice is the era of the male rabbi.
yt_1407,"डॉ , साहेब , लेभल अनुसार को मानछे सग बसेर अनरवाता दिनुहोला सुझाब मातर ।",0,youtube,"Dr. Sir, according to the level, I suggested that you sit down and give an answer."
yt_629,"रबि लाई पुलिस ले समातो रबि हत्यारा हो भन्दै खुब चम्कियो एउ टा नरपिसाच किसोर श्रेष्ठ भन्ने जन्तु , भिडियाे मिडिया मा फैलाउने पनि तेईहो भन्छन , तीन करोड जनता ले संखा गरे का छन त्यो जन्तु माथी बुदासैनि को हत्यारा तेइहो भनेर तेस लाई किन समातियेन ?",0,youtube,"Rabi was taken by the police as a murderer by Rabi, and the people who spread the videos to the media say they are the ones who killed the beast, why did not three million people count that beast as the killer of Budasani ?"
yt_277,प्रतिपक्ष मा बसेर मात्र भएन माननीय जि ।,0,youtube,"The opposition did not sit alone, Mr. President."
yt_1542,रास्ट्र कै गहना माथी यत्रो अन्याय हैट लालिगुरास लाई कडा कारबाही को माग गरौ साथी हरू ।,0,youtube,"Call for strict action against the injustice committed against the national jewel Hat Laliguras, my friends."
yt_1306,यस लाई तुरुन्तै खारेज गर्नु पर्छ ।,0,youtube,It should be dismissed immediately.
yt_765,"यो ओली को चम्चा घोकन्ते विद्यावाला « Phd sholar ^ खाते date सोध्छ , जेहोश ओली को उखान टुक् का सब रटेछ , यस्तै गुं घोकन्ते ले धेरै पढेर हो गतिलो पढ्ने को पनि नेपाल मा इज्जत न भा को !",0,youtube,"This one asks Oli about the date of the exam, and Josh Oli is all about the same, so he has to read a lot of books and not be respected in Nepal even for fast reading!"
yt_367,मेयर ज्यु यस्तो पत्रकार लाई त नाक को डारि मात्र हैन त्यस को त्यो जता भाबी लेख्ने हात पनि काट्नु पर्छ सलाम छ हजुर लाई देश को धमिरा हरू लाई नस्ट गर्न पर्छ आब जन फेसला हुन ऐक दम जरूरी छ.. ... .. !,0,youtube,"Mayor Ju, such a journalist must not only be scarecrow, but also cut off the hand that wrote the story."
yt_365,असली हिरो भने कै रबि हुन्न भन्ने जति हाजिर गरुत हजुर ।,0,youtube,"The real hero is a Kaari Rabin Hun, a grandfather who comes to the scene."
yt_1584,सुशील जि यो जनता को घाँटी निमोठ्ने घाँढो संघीयता घाम मा सुकाइदिनु पर्यो ।,1,youtube,The people of this country had to be dried up in the sun of the bitter federalist state.
yt_1043,यो पुन्य झोले लाइ कान को जाली फुट ने गरि हान्नु पर्ने ।,0,youtube,This old bag of liars should be hit by a fake foot.
yt_391,निर्दोष शालिकराम लाई मारेर निडर सहासिक जनता को हिरो रबि लामिछाने लाई फसाउने षड्यन्त्र हुदैछ सत्य तथ्य बाहिर अाउनु पर्छ र शालिकराम र रबि ले न्याय पाउनै पर्छ वास्तविक हत्यारा पत्ता लगाउनै पर्छ ।,0,youtube,"If the plot to assassinate the innocent Shalykram and ensnare the fearless and courageous public into the hands of the hero Rabbi Lamichane is to be carried out, the truth must be revealed, and Shalykram and Rabbi must be brought to justice and the real killer must be found."
yt_355,तिमि हरु सबै नेपाल आमा का कुपुत्र सन्तान हौ लुट लुटेरा हरु ।,1,youtube,"They are all nepal mother's nephew and son-in-law, and are plunderers."
yt_1517,घट्ना पियोर घटे को छ सोएम सभामुख ले आफ्नो गल्ती महसुस गरे को छ पुन्य गौतम समर्थन नगर ।,1,youtube,The SOM Speaker has realized his mistake in the incident of Pioor Ghatte and Pune Gautam Support Nagar.
yt_1142,"धन्यबाद मेयर यस्तै हुनु पर्छ यस्ता घुसखाेरि दलाल हरु लाई नाककाे डारि मात्र हाेईन उफ्रि उफ्रि घुमि घुमि लाता ले हानेर ढाड भाच्नु पर्छ , ।",0,youtube,"Thank you, Mayor, this is how these intruders should be, they should be able to run around and beat the cops with their noses out."
yt_1665,हिरासत मा सिसि क्यामरा हुन्छ खोइ त्यो देखाउने कुरा गर्नु पर्यो सुशील जि ।,0,youtube,I had to talk about showing the camera in custody.
yt_1683,सत्य तथ्य बाहिर ल्याउनु पर्यो ।,0,youtube,The truth had to be revealed.
yt_734,यो मा चिक्ने रन्डि को छोरो मास्टर लाई टुडिखेल मा जिउदै चिरि चिरि नुन खुर्सानि दल्लनु पर्छ ... .. खुकुरि ले घाटि रेटनु पर्ने थियो धन्यवाद रवि दाई अघि बढनुस् ।,1,youtube,It was necessary to put the salty sandwiches on the hands of the young master of the chicken randy while he was playing the game of turkey ... .. to keep the valley in check with his hands.
yt_1386,जय रबि जय नयाॅ नेपाल हुनेछ रबि दाजु लाई हामि 3 करोड जन्ता हरु ले प्रधानमन्त्रि बनाऊनपछ रबि दाजु लाई म जस्तै दिदि बैनि र दाजु भैई ले बिदेशि भुमु मा पसिना पोखाऊन पनेछैन भने आसछ जय रबि दाजु ।,0,youtube,Jai Rabi Jai Naya Nepal will be Rabi Daju we are the 3 crore people who will make Rabi Daju Prime Minister and then Rabi Daju will be sweating on foreign soil like me.
yt_1197,भ्रष्ट चोर दलाली हरु मठ मन्दिर को गुठी ब्याक्तीगत नाम मा गरिए को छ सरकार ले ठोस कदम चालोस ।,0,youtube,The government has taken concrete steps to change the name of the monastery to corrupt thieves and thieves.
yt_632,यो डिसलाइक गर्ने १२ जाना लाई रबि ज्यु हिरासत मा भए को मन पर्ने थिएछ भने पछि खाते हरु हो म त ईन्डिया बाट पनि कति खुशी छु रबि ज्यु बाहिर आउनु भए को मा ।,0,youtube,"If the 12 people who dislike this would have liked to have Rabbi Jew in custody, then how happy I am from India that Rabbi Jew came out."
yt_280,बम्जन 100% गलत छ भन्ने जति हात ऊठाऔ ।,1,youtube,Raise your hand as high as 100% false.
yt_1246,एकदमै सहि कुरा हो रबिन्द्र सर हजुर अगाडि जाँदै गर्नुस हाम्रो सपोर्ट हजुर लाई छ ।,0,youtube,It is quite correct that Rabinder Sir Grandfather is moving forward with our support to Grandfather.
yt_1585,याे नेता हरू सबै चाेर छन् यस्ता सबै चाेर नेता हरू लाई देश निकला गरनुपरछ संविधान नमाने पहिलो पाटि नै ने क पा हाे ।,1,youtube,"These leaders are all the way out of the country, and the first step to ratifying the Constitution is to get them out."
yt_1083,यो निलो कोटे लाई नाङ्गो परेर कोटेश्वर को जाम मा उभिन लगाउन पर्छ ।,0,youtube,This blue coat must be worn naked and the coat must be placed in a jam.
yt_43,मृतात् मा लाई हार्दिक श्रद्धासुमन र सम्पूर्ण का परिवारजन प्रति हार्दिक समवेदना प्रकट गर्दछु साथै परिवारजन मा धैर्यधारण गर्ने शक्ति मिलोस् ।,0,youtube,I pay my heartfelt respects to the deceased and express my heartfelt condolences to the entire family and may the family be empowered to endure.
yt_606,रंडि को छोरो रॉ को दलाल ।,1,youtube,Randy's son was a broker for Roe.
yt_1277,कुलमान सर तपाईं पनि अरु भ्रष्ट जस्तै टसमस गर्नु भयो भने यो देश ले धेरै दुख पाउने छ पछी नहट्नुस हिजो काखी च्याप्ने त्यस्ता कोहि छ्न भने प्रम नै किन नहोस् नाङ्गो पार्नुस ।,1,youtube,"Colonel Sir, if you have been insulted like other corrupt people, this country will suffer a lot, don't back down, don't touch anyone like that, don't be naked."
yt_1206,डा : सुरेन्द्र केसी ज्यु लाई ल्याऊनुपने थियो ।,0,youtube,Dr. Surendra Casey was supposed to bring Ju to the hospital.
yt_1082,डिसलाईक गर्ने हरु गधा हरु नेता का गोठाला हरु आजै मर साले हरु यति राम्रो खबर लाई डिसलाईक गर्छन् चोर हरु ।,1,youtube,"Dislikers, donkeys, leaders' shepherds, thieves, who are still dead, disliked by good news."
yt_1667,पहिले आफ्नो स्टाफ लाई बोल्ने तरिका सिकाउनुहोस प्रहरी हाकिम ज्यु ।,0,youtube,"First, teach your staff how to speak to police chief Jew."
yt_718,पुन्य गौतम ग्यानेन्द्र साहि को घटना मा नेकपा लाई आरोप लागे को भय रण्डि को बान किन तेरो पुलिस ले समाउदैन ।,1,youtube,The fear of the Necpa accusing Gautama Gyanendra Sahi of the incident does not include Ban Ki-moon to the police.
yt_861,पुलिस ले त जहिलेनि झुट बोल्छ साला ज्ञानेन्द्र साहि लाई हिरा सत मा कुट्छ कुटे को छईन भन्छ साला चोर पुलिस ।,0,youtube,"The police take it as often as he lies, Sala Gyanendra Sahi beats him in the diamond, says he is a thief, and says he is not a police officer."
yt_1268,पहिले कुलमान सर लाइ उज्यालो नेपाल को लागि धन्यबाद भनेर कुरा सुरु गरम पत्रकार दाजु ।,0,youtube,The first-time Chancellor Sir Li Ujjayalo started by saying thank you to Nepal for the warm journalists.
yt_460,सरकार हिम्मत छ भने रवि दाइ लाई फसायर देखा अनि थाहा हुन्छ के हुन्छ देश मा यसकाे मूल्य धेरै ठुलाे हुन्छ चेतना भय ।,1,youtube,"If the government has the courage to see Ravi Dai's facial expression and know what is happening in the country, the value of it is very high."
yt_1041,याे पुण्य लाई चाक मा अागाे लगाएर लखेट्नु पर्छ नचाहिने कुरा गर्छस् ।,0,youtube,"Or, to put the virtue in the palm of your hand, you must push it away without speaking."
yt_1379,बधाई को साथ मा अस्मिता नानि लाई पनि बोलाउनु भए को भए राम्रो थियो यो प्रेसमिट मा ।,0,youtube,It was nice to have invited Asmita Nani to this press conference along with congratulations.
yt_1079,यस्तो गुरु भ्नाउँदा हरु ले जहाँ पनि महिला माथि यौन सोसन गर्दछन् ।,1,youtube,Such gurus take the bhinnanda wherever they sexually assault women.
yt_543,लाईन मात्र होईना बिल नतिर्ने उद्योगी को घाटि काटनु प्रछ साले खाते हरु ।,0,youtube,"Not only the line but also the bill, the industrialist is losing money every year."
yt_654,हुनत मपनी क्षेत्री हो तर धिकार छ यो मुजि बाहुन बादी मिडिया र बाहुन हरु प्रति ।,0,youtube,"Although it is a matter of scope, it is a matter of concern to the media and the media."
yt_111,आलु भन मुला ... .,1,youtube,Potatoes are good but ... .
yt_755,मुजि गुरु रे भिखारि हो ।,0,youtube,Muji Guru Ray is a bhikkari.
yt_287,होइन यो देश मा भ्रस्टाचारी लाई पाता कस्ने आयोग छैन कि बिक्यो ?,1,youtube,Is this not a commission that finds corruption in this country and has sold it?
yt_1515,हुनत यस ले कुनै माइने राख्दैन तर पनि मानबता भन्ने केही कुरा पनि हुन्छ भन्ने चाहिँ भुल्नु हुदैन ... .. ।,0,youtube,"However, we must not forget that there is something that is not mine, but that is also respected ... .."
yt_1148,अति भए पछी मार्न र मर्न त पछी पर्दैन मान्छे नाक भाच्नु त पर को कुरा ।,1,youtube,"It's not too late to kill and die, but it's better to break your nose."
yt_489,सवै भष्ट लाई कानून बनायेर फासि दिनु पर्छ ।,1,youtube,The law must be passed and the corrupt must be executed.
yt_262,अपरिपक्व पत्रकार र च्याउ सरी चले का अनलाईन मेडिया नै जनमानस मा भ्रम फैलाउने माध्यम बने को महशुस हुँदैछु ।,1,youtube,I feel that the online media of immature journalists and Chau Seri Chae has become a means of spreading confusion among the people.
yt_735,धाेती सले चाेर खाते नेपाल अएर नेपाली चेलीबेटी लाई फासी गनुपछ बलात्कार लाई ।,0,youtube,A Dheti Sale Cher Account Nepal was founded by a Nepalese chelebiety who was hanged and raped.
yt_822,यो मुजि पत्रकार पनि रिसी धमला जस्तै रहेछ आफु मात्र बोल्छ बक्ता हरु लाइ त बोल्न देन भोडगधा ।,1,youtube,"This fellow journalist is also acting like a ricky dimple, but only speaks to his speakers and lets them speak."
yt_446,प्रत्रकार ज्यु ले प्रश्न सोधे को भयेन .. अध्यन गरनु प्ररो .. डा. सर तपाईं जस्ता वैदिक को यो देश मा कदर / सम्मान भयेन दु : ख द कुरा ... ।,1,youtube,"For example, Jews are afraid to ask questions, study them, and doctors like you, the Vedic, are respected in this country."
yt_1060,साला धोति लाइ करेन्ट लगाएर जुत्ता को माला र कालो मोसो दलेर भारत लखेट्नुपर्छ ।,1,youtube,Salad shoe wearers should wear a lace and black mousse to show off their shoes.
yt_616,राजा हटेर जन्ता लाई के फाएदा भयो जन्ता झन बल्त्कार चोरि बडे को छ कि चोर पनि कस्तो ३८ कुईन्टल सम्म चोरि हुन्छ प्रचन्ड र केपि अोलि दुई जना ले जन्ता अघाए को हो रराज अतिए र मात्र गनतन्त्र अाए को नअातिनु हो भने नेपाल मा गारो हुनथियो ।,0,youtube,"The king removed the Janta to the benefit of the Janta to the king, and the king removed the Janta to the benefit of the Janta to the king, and the king stole from the king, and the thief also stole from the king to 38 quintals."
yt_608,प्रचण्ड त रेबिच लागे को कुकुर होस ।,0,youtube,You're a great dog to ride.
yt_1158,के जबर्जस्ती माफी माफी को कुरा गर्छ यस् को पानी नाक को डाटि बाच्नु पर्छ की के हो ?,0,youtube,Does a forced pardon speak of a pardon for someone who has to scold his nose ?
yt_1581,सुशील ज्यु को खरो पना सारै राम्रो छ सुशिल जी साचै खरो भैदिनुस है नेता धेरै भ्र्ष्ट छन कोहि राष्ट्र प्रेमी छन भ्र्ष्ट हरु को झ्या को हार्नुस है ?,0,youtube,Sushil Ji is as good at getting his hands on the ground as he is good at getting his hands on the ground. Sushil Ji is really a good brother. The leader is very corrupt.
yt_291,याे चाेर मानवअधिकार बादी चाेर कालाे कांग्रेस को भतुवा के भनछ मुजि तालु ।,1,youtube,"The Chairman of the Human Rights Committee, Chairman of the Black Congress, has been asked to grant a grant."
yt_284,"एउ टा प्रहरी को प्रबकता ले घरि घरि झुट बोल्नु ठिक हुदैन , , यो घटना मा पनि 100% प्रहरी को गलत छ , ।",1,youtube,"It is not right to lie to a police officer in order to promote it , even in this case the police officer is 100% wrong ."
yt_796,यो मुजि नगेन्द्र भन्ने गणतन्त्र को झोले अनि चाकरी हो ।,1,youtube,This is the bag and the servant of the Muji Nagendra Republic.
yt_1510,2 / 4 बर्ष अध्यन गरेर आउदा राम्रो ।,0,youtube,Two and a half years of studying are better .
