id,text,label,dataset,text_en
yt_233,गगन जि को कुरा त सहि हो तर प्रति पक्ष ले गनु पने काम कडाइ का साथ गरिए को छैन सरकार ले गरे का नराम्रा काम को बुलन्द रुप मा अावज उठाउनु परो हामी तपाईं को साथ मा छौं ।,0,youtube,"If Gaganji is right, if the work you have done is not done with determination, if the government has done a bad thing, we stand with you."
yt_229,धमला अरु को ( बोलाए को गेस्ट को ) कुरा सुन्न नसक्ने कस्ता पत्रकार ।,1,youtube,A journalist who cannot hear Dhamala Aru (called a guest) is a journalist who cannot hear.
yt_1299,डा. साब ले भने को कुरा एकदम सहि हो यो मुलुक मा सङ्घियता चल्दैन अब बिकल्प खोज्नै पर्छ चोर र छाडा तत्र त्याग्नै पर्छ ।,0,youtube,"Dr. Saab is right in saying that this country is not a federation, and now we must find an alternative, rob and leave, and leave."
yt_678,उस्ता मुजि पनि देश को राष्ट्र पथि थुक्क साला ।,0,youtube,The Usta Muji also shocked the country by the nation.
yt_1594,जन भावना सडक मा देखिए को सरकार प्रति को बितिस्ना लाई राजाबादी को नजर ले हेर्नु भन्दा आखा को चस्मापो बद्ल्नु पर्नी होकि ?,0,youtube,Should you change your eyeglasses instead of looking at the government and the public opinion?
yt_905,त साली भालु आफ्नो अनुहार हेरे को छस ।,1,youtube,The bear looked at his face.
yt_932,सर्प नि मरोस् लाठी नि नभाँचियोस् तेसरी कदम चालियोस् ।,1,youtube,"The serpent will die and the stick will be broken, so that the third step is taken."
yt_303,लम्पट स्वार्थी भ्रष्ट नेता ले ।,1,youtube,"A selfish, corrupt leader takes a lump."
yt_1540,नेपाल सरकार ले रबि सर लाई सुरक्षा दिनु पर्छ ।,0,youtube,The government of Nepal must provide security to Rabbis.
yt_107,यो डिसलाइक गर्ने १२ जाना लाई रबि ज्यु हिरासत मा भए को मन पर्ने थिएछ भने पछि खाते हरु हो म त ईन्डिया बाट पनि कति खुशी छु रबि ज्यु बाहिर आउनु भए को मा ।,0,youtube,"If the 12 people who dislike this would have liked to have Rabbi Jew in custody, then how happy I am from India that Rabbi Jew came out."
yt_1193,बन्जाडे मुला अलिक ठुलो नेता हरुलाइ लेउनु न हौ ।,0,youtube,Don't take a big but a small leader away.
yt_175,"सुशासन रहित , भ्रष्ट ब्यक्ति हरु सत्ता मा रहे को स्थिरता झनै खतरनाक छ ।",1,youtube,"The stability of the unruly, corrupt people in power is increasingly dangerous."
yt_832,सबै नेता हरु चाेर हुन र पानिमाथिकाे वबानाे बन्न खाेच्छन डम्ना हरु ।,0,youtube,All the leaders want to be more than just leaders and become the flood controllers.
yt_353,याे हाे नि त देश र जनता ले मागेकाे नेताकाे लाइन ।,0,youtube,This is the line of leaders who have asked for the country and the people.
yt_935,ऋषि धमलालाइ देख्दा र यस् को प्रश्न सोधाइ को तरिका सुन्दा उडेर गएर यस् को नाक को डाडी फुटालि दिउ जस्तो लाग्छ ।,0,youtube,"When Rishi sees Dhammalai and hears the way to ask questions, he seems to fly away and blow his nose with a razor."
yt_637,त्यो कन्डम फुटेर जन्मे को दिल निशानि ले मात्र हो रबि को बिरोध गर्ने ।,0,youtube,The condom is broken and the heart is marked only by the birth of the rabbis.
yt_1341,Right man Right place Reward and punishment को सहि सदुपयोग गर्नुपर्छ ।,0,youtube,Right man Right place Reward and punishment should be used appropriately.
yt_61,मन्त्री भन्दा नि ठुलाे नेता बिस्नु पौडेल भुमाफिया को दलाल भए पछि बिचरा मन्त्री को पद मात्र होईन राजनीतिक जिवन नै समाप्त हुने होला अनि के को कार्वाहि ।,1,youtube,"After the leader Bismillah Bhumibol was made a broker of the Bhumibol people, the middle minister would not only have a post but also a political life and work."
yt_112,उध्योग ले पनि लुट्नुसम् मा लुटे को रहेछ ।,1,youtube,"Even with the help of the drug, the robbery is still a robbery."
yt_1583,गु खा अब देशी कुकुर ।,1,youtube,They are now native dogs.
yt_1178,जन्ताकाे सुरश्रा एउटा महिला बिच बटाे मा खलासि बाटा कुटिनछिन अनि काहा छ सुरश्रा ।,0,youtube,Jantake Surashra is a woman who is a potato-eating potato and a cow.
yt_1067,652 जना dislike गर्ने हरु सङ म एक्लै मैदान मा fight गर्न चाहान्छु बलात्कारि हरु दम छ छ भने cmt reply गर any time any wher I am raedy ✊✊✊✊✊ ।,0,youtube,652 people who dislike me want to fight in the street alone on the field rapists are dying if cmt reply get any time any where I am raedy  .
yt_70,सबै भातामारा दाका हरु हुन कुलमान सर मात्रै हुन असल इमानदार ब्यक्ति हुनुहुन्छ उहाँ ।,0,youtube,All the brothers and sisters are the only ones who are honest.
yt_916,"टुड़ीखेल मा लखेटी लखेटी जुत्ता ले पिट्नु पर्ने मान्छे - केशब बडाल , गाउँ टोल मा समाज , घरबार बिगार्ने फटाह आइमाई - पद्मा अर्याल ।",0,youtube,"The people who should be beaten with their shoes in the sport of cricket - Keshb Badal , village Tol Ma Samaj , housekeeper Bhagarne Fatah Aimai - Padma Aryal."
yt_20,रबि दाजु प्रति सलाम छ ।,0,youtube,And peace be upon the Daju .
yt_1578,पैसा को मुख कालोहुन्छ भन्छन यी लोभिपापी लाई पैसा दिन्न छोडनुपर्छ कृश्चियन सिर्चियन सिधिन्छ ।,1,youtube,The blacksmiths of money say that these greedy sinners should not give money to the Christian church.
yt_938,यो व्यवस्था फेल भए झुण्डिएर मर्छ यो धमला ।,1,youtube,"If this law is broken, he will be hanged and killed."
yt_515,हजुर को कार्यक्रम राम्रो छ यी सबै ले आफ्नो पावर भएको बेला सरकारी जमीन को त के कुरा देश पनि बेचीसके यी चोर नेता हरू ।,0,youtube,"The program of Grandfather is good, and while they have their power over all these things, they have sold the land and the country even."
yt_746,आनुहार हेर्दा नै दलाल भ्रष्टाचारी गुण्डा देखिन्छ ।,0,youtube,The look of the broker is a corrupt one.
yt_1565,बहुला कुकुर हरु लाई बाँधेर मारिन्छ भने बहुला नेता हरु लाई पनि यसै गर्ने की. ... ... की कसो मेयर ज्यू ।,1,youtube,"If many dogs are tied up and killed, many leaders will be killed in the same way."
yt_322,वा के राम्रो बोली पत्रकार मित्र ज्यु छड्के सलाम छ हजुर लाई धन्यवाद ।,0,youtube,Or a good speech journalist friend of Jewish people who greeted you greetings.
yt_910,त्यस पछि देश मा हत्या हिंसा लुट बलात्कार जताततै हाहाकार कोलाहल हुनेछ ।,1,youtube,"After that, the country will be in a state of murder violence looting rape is a heated up riot everywhere."
yt_918,कुनै पनि कारयलये मा धुस मागे भने चाक मा आगो लगाइन्छ ।,1,youtube,"If a fire is set in motion in any work, the machinery is set on fire."
yt_1459,नेपाल ले अब केही प्रगती गरोस ।,0,youtube,Nepal is now making some progress.
yt_1503,सर कमसेकम श्रद्धान्जली त दिनोस ।,0,youtube,Sir at least a devout and sincere devotee.
yt_540,साला कुत्ता थग हरुलाइ छोद नु हुदैन एउटा गरिब जनता ले दुई चार सय रुपया नतिर्दा लाइन कात्ने अर्बौं रुपिया नतिर्ने साला कुत्ता हरु यस्ता कुत्ता हरुलाइ नछोद्नु कुल मान सर ।,0,youtube,"A poor people don't have to pay two hundred rupees to the poor, cut a line of two hundred thousand rupees to the poor, and don't give up such dogs."
yt_1434,रबि जिन्दबात भोलि को दिन मा फेरि दायाँ बायाँ नराम्रो जात भात मा फरक नआवस है रबि सर आज जति तपाइ को सपोट गरे फेरि नराम्रो भो भने हामी येस्तै त हो नि ब्रो हुन्छ नि ज्ये रबि सर ।,0,youtube,"Rabindhat tomorrow again in the day, the right to the left bad race rice is no difference Raby sir, as much as today you supported the you again bad food we are like this then yes, brother, nay, Raby sir."
yt_756,"त्यो बलात्कारी बाउ को छोरो कता गयो मुजि , रबि दाजु हिरासत मा हुदा खुब 10 लाख माग्यो भनेर आरोप लगाईरा को थियो रण्डि को छोरो ।",1,youtube,"The son of the rapist Baou Muji, Rabi Daju in custody, was accused of demanding Rs 10 lakh from the government."
yt_490,याे Dij झुट बाेल्छ ज्ञानेन्द्र शाहि काे बारे मा पनि झुट बालेकाे छ ।,1,youtube,"He lies, and so has Gyanendra Shah."
yt_1156,मेयर काे कुरा सहि छ जज् ले जे जे भनेपनि भ्रस्टचारि लाई पिटेरै तह लगाउनुपर्छ साले हरु लाई मेयर साहब जिन्दावाद ।,0,youtube,"The mayor is right in saying that whatever he says, the corrupt should be beaten to death and slaughtered."
yt_648,जनतालाइ विभाजन गर्ने नै चोर नेता हरू हुन ।,0,youtube,The thieves who divide the people are the leaders.
yt_576,साबित्र सुबेदी चुतिया हो यस् लाई कार्वाहि गर ।,0,youtube,"The sacred subject is to be a woman, and do what you want."
yt_1586,गएर केपि काे पिके काे मुत खा ।,1,youtube,Go and drink some coffee and eat some mut.
yt_1461,एक अर्का को साथ र सपोर्ट बिना राष्ट्र मा अमन चयन प्राप्त हुन सक्तैन त्यसकारण आफ्नो पालो मा अरु बाट सपोर्ट लिने र अरु को पालो मा पनि आफू ले सपोर्ट गर्ने बानी को विकास गरौं यसैमै कल्याण छ| सबै को जय होस् ।,0,youtube,Peaceful selection in a nation cannot be achieved together and without support. Let us therefore develop the habit of supporting each other in our own ways and others in our own.
yt_1660,पत्रकार मित्र मेयर साब ठिक हो जेनि सुद्नु आवसेक छैन हामि ले बुजे का छौ ।,1,youtube,"My friend the journalist Mayor is fine, but we are not alone."
yt_999,"श्री श्री श्री ३ रबि लामिछाने महाराजअधिराज सरकार बाट चाहिँ राष्ट्रिय टेलिभिजन बाट भ्रष्टाचारि लाई टुंडिखेल मा राखेर उडेर गुडेर के के गरेर नाक को डाँडी भाच्न मन छ , भन्दा चै लामिछाने हिट !",0,youtube,"Sri Sri 3 Rabi Lamichane is keen to punch the nose of Sri 3 by putting corruption on national television and keeping it in the dust, rather than chasing the Lamichane!"
yt_601,म लाई नेपाल मा राजा चाहिए को छ के अब म नेपाली हाेईन् साला हाेलिवान् काे दलालि बडि नबाेल ।,0,youtube,I was born in Nepal and now I am a Nepalese hein sala hallivan ka dalli badi nabale.
yt_1569,लौ न सर अब त ढिला भैसक्यो छिट्टै प्रधानमन्त्री को लागि लड्नु पर्यो बनाउने जिम् मा हाम्रो को को सहमत छौ ️ ️ ️ ।,0,youtube,"No sir, it's too late now, and soon you'll have to fight for the Prime Minister to make Jim agree with us ️ ️ ️ ️ ️."
yt_1075,येस्ता ढुङी हरु को चाक मा खुर्सनी दल्नी पर्छ ।,0,youtube,These stones must be crushed into the hand.
yt_1284,नेपाल मा राज तन्त्र को जरुरत छ ।,0,youtube,Nepal needs a political system.
yt_1617,पत्रकार ज्यु हत्यारा ले sp को पद बढाइदिन्छु भनेर यो काम भए को छ र लेखपढनै नभए को पनि sp हुदारैछन पनि भनेर सोद्नुस न ।,0,youtube,Don't think that this is a job to raise the rank of a Jewish journalist assassin and that no one who doesn't read articles is being punished.
yt_558,यो बिच मा बस्ने कुकुर त्यही काङ्ग्रेस को दलाल हो साले बचाउ मात्रै गरेर बोल्ने साला कुत्ता ।,0,youtube,This dog that lives in the middle is the same Congressman who is the only talking dog who can save the world.
yt_52,सलाम कुल्मान सर हजुर् को पछी २ करोड ९० लाख जनता छ ईनी हरु को असुल गर्नुपर्छ ।,0,youtube,Salaam Kulman Sir Hajur is followed by the 2.9 crore people who need to be rescued.
yt_524,जरा मात्र गाडे को होइन मुला रुख नै बनिस को के ल्याङ्ग कुरा गरे को यार बिस्व् को 3 नम्बर भर्स्टाचार हुने मुलुक भन्ने बित्तिकै थाहा पाउन त् ।,0,youtube,"Not just the cars, but the people who talk about the sexuality of the people, you will soon find out that the world is the number three most corrupt country."
yt_456,यी गधा नेता हरु जति दुध ले नुहाएर गाई बन्न खोजे पनि यिनि हरु को कर्यसैली र नियत प्रष्ट सङ जनता ले बुझिसके का छन् आगामी चुनाव मा देखाइ दिनेछन् यिनि हरु को औकात ।,1,youtube,"These assheads, even though they try to become cows by drinking milk and drinking, have been taught by the people the way to do business and the way to do business, and will show up in the upcoming elections as an average."
yt_1355,तेरी मा सुड्डो अन्तरवार्ता दिन आए पछि आलोचना मात्रै गरेर हुदैन विकल्प र समाधान को उपाय खोइ दिन सके को अन्तरवार्ता भने को तार्किक निचोड दिन सक्ने हुनुपर्छ ।,0,youtube,"Your mother sued not only criticize the interview after the day comes, but also lose the option and the solution to the problem."
yt_1191,"के भए का कम्युनिस्ट हुन जता पनि हिंसा , बलात्कार र हत्या मात्र गर्ने ?",1,youtube,"Why should a communist, even if he is a communist , only commit violence , rape and murder ?"
yt_1039,पुन्डे लाई गाला फुट्ने गरि हाने को हेर्न मन छ ।,0,youtube,Punde is eager to see the poor man's throat burst.
yt_221,हरेक कार्यक्रम मा आउनी सानो देखि ठुलो नेता हरु भ्रष्टाचारि लाई काराबाही गर्नु पर्छ भने को सुनिन्छ ।,1,youtube,Every event has heard leaders from small to large say that corruption must be cured.
yt_1664,पोख्रेल लाई सुर्खेत को dsp लाई बोलायर ज्ञानेन्द्र सर को साथ मा पत्रकार सम्मेलन गरि कुत पित गरे को होकि होइन भन्ने बुज्दा हुन्छ अनि त्यो सुर्खेत को प्रहरी सहि होकि गुन्दा हो था भै हाल्छ नि ।,0,youtube,"Pokhriel learns that the headline of the story is not a dog, but a news conference with DSP, called by the name of Gyanendra Sir, and that the headline is a police report."
yt_1294,यो कुरा नेता ले बुझ्नु होस ।,0,youtube,This is something that the leader must understand.
yt_352,"बाकिनै अब यहि त थियो , गुठी , अरुत सबै खतम भै सके को , नदिनाला , कलकारखाना , धर्म , सस्कृती , गै त सक्यो , बा की आस लाग्दो नेपाली सेना छ , गुठी , ।",1,youtube,"But now that it was over, the Ghouta , the Arut all ended , the rest is gone , the Nadinala , the artworks , the religion , the culture , the gaat was gone , the Nepali army is waiting , the Ghouta , the Ghouta , the Ghouta ."
yt_749,राजा बाट जनता भए भने तिमि त जनता बाट नेता भ का हौ भोलि फेरि फर्किनु पर्ला याद राख चोर नेता र भ्रष्टाचार कर्मचारी ।,0,youtube,"If you are a leader of the people from the king, you are a leader of the people from the people tomorrow and again remember Perla remember thieves leaders and corrupt workers."
yt_1375,रबि दाई अब सबै भन्दा पहिला त्यो किशोर श्रेस्ठ भन्ने कुकुर लाई नङाउनु पर्यो ।,1,youtube,"Rabbi Dayi now had to first unbutton that teenager's dog, the Shreeth."
yt_807,"याे पाेखरेल खाते चाेर बर्दिकाे नाम मा कलङ्क हाे , , थुक्क , , , किरा पराेस ।",0,youtube,"The Pakherel account is called Chher Bhardaike Ma Kalank Ha , Thuck , , , , Kira Parays ."
yt_377,डा. सुरेन्द्र को बिस्लेसन सही लाग्य ।,0,youtube,Dr. Surendra has found the correctness of the bible.
yt_709,यो अपराधि प्रचन्डे को झोले धेरै फुर्ति नगरे हुन्छ पुन्य गौतम कुकुर हो ।,0,youtube,This criminal who is in a very busy city is a very popular Gautama dog.
yt_980,"यो गोकुले चुतिया र खतरनाक छ , , , यस लाई राउन्ड किक हानेर नाँक को डाँडी भाँचिदिनुपर्छ ।",1,youtube,"This gocule is fucked up and dangerous , and it must be rounded with a kick to break the nose."
yt_778,"साला खाते नेता हरू चुप लाक अब नेपाल मा नेपाली जनता ले , राजा लेयाउने हाे जय राजा जय नेपाल राजा ले नेपाल बनायाकाे हाे नेपाल ले राजा हाेईन् राजा अाउ नेपाल बचाउ ।",0,youtube,"Sala account leader Haru Chup Laak now Nepal in Nepali people take , king bring Haay Jai Raja Jai Nepal King Le Nepal madeake Haay Nepal Le Raja Hein Raja and save Nepal."
yt_542,मुजि बक्बास नगरी राजस्वा तिर्ने कुल मान घिसिङ्ग जि लाई अफ्ठेरो मा पार्ने काम बन्दा गर बिधुत छोर दलाली ब्यपारी हो ।,1,youtube,Muji Bakbas Nagari Rajswa Tirtne Total Value Ghising which was built in Afthero is a business of electrical end brokerage.
yt_538,साला कुत्ता थग हरुलाइ छोद नु हुदैन एउटा गरिब जनता ले दुई चार सय रुपया नतिर्दा लाइन कात्ने अर्बौं रुपिया नतिर्ने साला कुत्ता हरु यस्ता कुत्ता हरुलाइ नछोद्नु कुल मान सर ।,0,youtube,"A poor people don't have to pay two hundred rupees to the poor, cut a line of two hundred thousand rupees to the poor, and don't give up such dogs."
yt_1255,नेपाल् का इम्रान खान हुन रबिन्द्र मिस्र समय मै चिनौ ।,0,youtube,The Nepalese Imran Khan is Rabindranath Tagore of Egypt.
yt_830,थुई का जुन चोर उस् को ठूलो सोर भष्र्टचारै भष्र्टचार अझै लाज लाग्दै चोर हरु ठुला ठुला डा को गर्छ ।,0,youtube,"The thief of the Thieves is a great thief, and the thief is still ashamed of his own corruption."
yt_250,"सुशील सर लाई देखे पछि उहाँ को कार्यक्रम नहेरी निद्रा नै लाग्दैन , , , लागिरहनुस हजुर सहि हुनुहुन्छ ।",0,youtube,"After seeing Sushil Sir , he does not feel sleepy , but he is very well-adjusted to the program ."
yt_1230,"अब बिदेश मा भए को सबै दाजुभाइ दिदिबहिनी हरु लाई पनि समेट्नु पर्छ अनि हुन्छ , किनभने देश बेचिसकेउ यस्तो अजिङ्गर हरु ले , ।",0,youtube,"Now all the brothers and sisters abroad must be brought together , and so it is , because the country is sold and such giants are taken ."
