id,text,label,dataset,text_en
yt_917,सोम प्रसाद पाण्डे को चाहीं गर्धन भाचीने गरी हान्नु पर्ने सर्बहारा बर्ग को नेतृत्व गर्ने हरू खरब पती भैसके अझ तेस्तो छैन भंछन यो भंदा हास्यास्पद अरु के होला ?,1,youtube,"Som Prasad Pandey wants to lead the Serbhara Berg, who is to be hanged by the neck, but not the trillions of husbands."
yt_1297,भिमार्जुन ज्यु को अभिव्यक्ति समय सान्दर्भिक छ हिजो के भयो थाहा भएन अव भने हामी ले वुझेर देश वचाउन वनाउन लाग्नु जरुरी छ ।,0,youtube,"The time of the Bharmajun Jhu's expression is relevant if we do not know what happened yesterday, we must start to speak out for the country."
yt_812,बोल्नै मिल्दै न भ ने किन आय को त रन्डी को छोरो त पुलिस जे सोदे पनि बोल्नै मिल्दै न भन छ यार अनि मेरो लाडो गर्न आय को मुजि ।,1,youtube,"We can't talk about what the income is, or leave Randy or the police who can't even talk about it, man, and we can't even talk about what the income is to make my money."
yt_721,देस र जन्ता को सेवा गर्छु भन्न लाज लाग्दैन रन्डि को छोरा पुन्री गौतम ।,1,youtube,"Randy is not ashamed to say that he serves the country and the people, but his son, Puri Gautam."
yt_209,यो पुण्य गौतम जड्या हो जस्तो कस कस लाई लाग्छ ।,1,youtube,This is a virtue that Gautama is rooted in as much as anyone can imagine.
yt_261,डुङ्गडुङ गनाए को चोरहरुलाइ चार बर्ष पछि प्रधानमन्त्री हुन्छु र यी सबै प्रधानमन्त्री हरु देखि कर्मचारी हरु भष्टचारि लाइ टुडिखेल मा राखेर कन्चठ मा गोलि ठोक्छु ।,1,youtube,"Four years later, the thieves of the Dongdong Ganae become Prime Minister and I see all these Prime Ministers and shoot at Kanchath, putting employees in a bad mood."
yt_1469,नेता ज्यु हजुर को बोली र बिचार जस्तै बेबाहार होस् ।,0,youtube,Leader Ju Ju Juur should be treated as if he were talking and thinking.
yt_1492,"आमा भयपछी आफ्नो छोरा छोरी .. बोल्न , देख्न , सुन्न नसक्ने भयपनी मन को कुरा बुझ्नु पर्छ ।",0,youtube,"A mother who is afraid must understand the fearful mind of her child , who cannot speak , see , or hear ."
yt_1406,बोल्न त सिक धमला ।,1,youtube,Learn to speak and be patient.
yt_256,रबि लाई फसाउने काम हो मेरो पमि रबि लाई साथ छ ।,0,youtube,"It is a task to trap Rabbi, my husband is with Rabbi."
yt_1305,डा. साब को कुरा मा १००% सहमत हुँदै संघियता खारेज गरोउ र पुर्ब राजा लाई पुनर्स्थापना गरोउ टन्टै साफ ।,0,youtube,I agree with Dr. Sab's opinion 100% that the union should be abolished and the restoration of the East King to the country of Garoo Tantai clear.
yt_571,यो रन्डी सावित्री लाई Dna तेस्त गर यो पनो छक्का हो ।,1,youtube,This Randy Savitri is a Dna Teest if it is a PNO six.
yt_1419,"कुरै नबुजि मेयर बिरूद्द नबोलौ साथि हरू रवि लामिछाने पनि ठिक छन् मेयर पोनि १०१%ठिक छन् हामि गाउ ले को भाशा यस्तै हो , कसैलाइ आपत्ति भय अदालत जादा हुन्छ , ।",0,youtube,"Quray Nabujji vs. Mayor Nabolou and his colleagues Ravi Lamichane are also OK, Mayor Poni is 101%, we have a village le co co dialect similar, some people are more afraid of the court , ."
yt_2,यो पुलिस न पहिला ठिक थियो न अहिले ठिक छ यस्तो लाई बोलाउनु हुदैन ?,1,youtube,"This police force was not good before and is not good now , so it is not called ?"
yt_806,यो मुजि Dig को काम छैन यो कसरी Dig सम् मा बानना पुग्यो यो साला नेता हरू को झो ले रैछ यो साले को हावलदर को जति पनि छ्मता नभए को जस्तो देखिन्छ ।,0,youtube,"It's not the work of Dig Dig that's how Dig Sum got here, it's the way it's been, it's been taking the leaders to sleep, it's been looking like it's not as good as Howler."
yt_1538,विदेश बाट हेरने को को हुनु हुन्छ साथी हरु मेरो चेनल मा पनि जोडीनु होला साथी हरु ।,0,youtube,Friends who are from abroad are also friends who have joined my channel.
yt_1055,धाेती सले चाेर खाते नेपाल अएर नेपाली चेलीबेटी लाई फासी गनुपछ बलात्कार लाई ।,1,youtube,A Dheti Sale Cher Account Nepal was founded by a Nepalese chelebiety who was hanged and raped.
yt_676,केपि चोर को पछि लागेर आफ्नै श्रीमान मार्ने छि छि अब धेरै छैन तिम्रो दिन ।,0,youtube,Any man who chases a thief and kills his own husband is not much longer than your day.
yt_547,यो मुजि गणतन्त्र नेपाल को लागी अभीसाप हो नेता र उनी हरु को पेट भर्न को लागी मात्र र उनी हरु का झोले कार्यकर्ता साथसाथै रीसी धमला को कुरै नगरौ ऊ पनी पर्चन्डे को पुछर हो यो पत्रकार को बाहाना मात्र हो ।,0,youtube,It is just wrong for the Muji Republic of Nepal to be a leader and it is only to fill their stomachs and their sack workers as well as Reesi Dhamla to curry the town and ask the police to answer it is only to talk to the journalist.
yt_1118,यो गधा ले झुट बोल्यो इन्काउटर को नाम मा मान्छे मार्न पाईन्छ मुठभेड भए को मान्छे को हात 3 ठाउ मा भाचिन्छ ।,1,youtube,"This asshole lied in the name of the Encounter, killing people, and when confronted, shaking hands in three places."
yt_1551,साला यो यता हाजिर उता हाजिर भन्ने देखेर त यस्तो रिस उठ्छ कि कुरै छोड राम्रो Coment गर न हो ।,0,youtube,"Seeing that this year is already here, it is so annoying that there is no good comment."
yt_1068,कानुन को जिम्मा लगाउनु भन्दा पहिले हात र खुट्टा भाच्नु पर्ने थियो नि ।,0,youtube,"Before the law was enacted, the hands and feet had to be broken."
yt_1697,कम से कम वायु प्रदूषण त कम हुन्छ ।,0,youtube,At least air pollution is reduced.
yt_1666,सुशील पाण्डे सर को प्रश्न खरो हुन्छ तेसै ले होला म लाई एकदमै मन पर्छ सधैं हजुर को सपोट मा छौ हामी सधै राम्रो काम गर्दै जानु होला ।,0,youtube,The question to Sir Sushil Pandey is very serious and I really like it when you always support your grandmother.
yt_926,यो तालु खुइले धेरै चम्किदै छ यस को टाउको मा सिधै गोली हान्नु पर्ने थियोे ।,1,youtube,This tailgate is so bright it would have to be shot directly in the head.
yt_1208,"अब देश नै सक्नु लाग्यो , , अब पाकिस्तान को जस्तो इमरान जस्तो नेता को खाँचो छ ।",0,youtube,"Now the country has begun to grow , now Pakistan needs a leader like Imran ."
yt_1180,प्रहरी को यातना भने को कालो बुट ले ( जुत्ता ) जहाँ मुटु छ जहाँ किड्नी छ !,0,youtube,"If you torture the police, take the black boot where the heart is where the kidney is!"
yt_1358,तपाइँ हरु जे पायो तेहि हेडिङ नराख्नुस !,0,youtube,Don't be headlining what you've got!
yt_1201,बरु यातना दिन आउदैन भने मलाइ बोलाइयोस ।,1,youtube,"But if the day of torment did not come, I would have called you."
yt_975,यो माचिक्ने प्रचण्ड लाई मार्नु पर्छ ।,1,youtube,This is a huge catastrophe that must be killed.
yt_1372,"समर्थन हरु जती पनि आन्दोलन मा भित्र ग को छन सम्पुर्ण लाई तुरुन्तै रिहाई गर्न माग गर्नु पर्छ , , , ।",0,youtube,Any supporters who are involved in the movement should be asked to release all those who are involved immediately.
yt_727,यो पन्ने मुजिलाइ ब्रेनवास गर्नकोलागि राडिकाछोरा ले खटाए को छ ।,0,youtube,This page is dedicated to the brain-brain transplant of a child.
yt_380,छि छि त्यो फता ऋाषि ।,1,youtube,I am the fateful sage.
yt_483,"धन्येबाद एभिन्वुज कार्येक्रम सन्चालक ज्यु , जब छान्बिन को प्रक्र्ये मा छ भने त्यो भिडियो प्रसारण गर्ने मिडिया नखोजि रबिलामिछाने लाइ हिरासत मा लाने वाआअ एस्लाइ प्रहरी को कालो कर्तुत अथबा भर्स्त हरु को दबाब को कारण कस्तो न्याए ?",0,youtube,"Jewish, when Chhanbin is in the process of making the video, when he is not looking for the media to broadcast the video, how do you think the police are pressured to do so?"
yt_828,यस्ता गद्दार नेता हरु लाई गलत्याएर फाल्नुपर्छ आम जनता मिलेर यस्ता पनि नेता हुन्छन् कुकुर जस्तो खान नपाए जस्तो लुछाचुडी ।,0,youtube,"Such traitorous leaders should be mistakenly thrown out of the way, and the common people should join forces to make leaders like dogs who are not fed or cheated."
yt_1462,"गगन थापा ज्यु नमस्कार , अब यो देश को जनता को रगत तातिए को छ मुटु थर्किए को छ शाहि माथि काे अाक्रमण ले गर्दा जनता को मन चर्किए को छ , त्यसैले जनतालाइ सान्त्वना दिदै आबाज ऊठाऊनुहोस् ।",0,youtube,"Gagan Thapa Ju hello , now this country is in a state of bloodshed with the people, heartbreak with the people, heartbreak with the people, and heartbreak with the people when they attack the Shah , so please raise your voice and comfort the people ."
yt_292,मुन को मुत खाको चोर हरु लाई गूठी देखि सकेनन् ।,1,youtube,The thieves who were eating the beans could not be seen.
yt_521,यसभन्दा पहिले पनि त तिमी भाते हरु नै अालोपालो सत्ता मा थियौ नि पाजी हरु ।,0,youtube,"Before that, you were the brothers of the Ahlopolis who were in power."
yt_577,यो राणी सावित्री रन्डि हो ।,1,youtube,This is Queen Savitri Randi.
yt_965,यो बम दिदीबहिनी लाई पाता कसेर कोर्ला हाने पछि मात्र निर्मला पन्त को काण्ड वास्तविकता निस्किन्छ ।,0,youtube,It is only after the bomb hits the sisters that Nirmala Pant's misguided reality becomes apparent.
yt_1333,देश मा विकास हुनुपर्छ त्यो पनि कुशल कार्यशैली का साथ अब राजा आउनु पर्छ हिन्दु राष्ट्र सहित को संघीयता र सबै पक्ष ले मिलेर देश बिकास लाई प्राथमिकता दिनुपर्छ ।,0,youtube,"The country must develop, but now the king must come with a skilled work ethic, a federation including the Hindu nation, and a partnership of all parties to give priority to the country's development."
yt_269,सबै जवाफ नरम र सम्मानित छन ।,0,youtube,All answers are gentle and respectful.
yt_1622,सुशील सर दिनै कंग्रेस र कम्युष्ट लाई येसरि नै ल्येर बहस गरानु होला सुन्न मजा अाउदो रहेछ चोर चोर को पोल खोला खोल्ल हामी बिदेशि युवा सुनेर टाएम पास गरछै ।,0,youtube,"Sushil Sir has been debating the Congress and the Communist Party for days and enjoying the debate, listening to thieves, pounding thieves, and we are passing the time by listening to foreign youths."
yt_18,अब गूठी मा हस्तक्षेप गरिरहे का छन ।,1,youtube,Now they are interfering in the mouth.
yt_97,गल्ती धाकछोप गर्न खोजी राखे को छ ।,1,youtube,The mistake is to keep trying to cover it up.
yt_1627,अानन्द पाेख्रेल जि ठुला ठुला भरष्टचार काे सम्रक्षेण राजनिति दह बाट हुन्छ सिधै भन्दा भयाेनि कि कुरा चपायर किन बाेल्नु ।,0,youtube,"Anand Pakhrel, who is a politician who is a corrupt public figure, is more afraid than ever of what to say."
yt_51,रत्नपार्क मा ब्यपार गर्ने हैसियत छैन भनेर अाफ्नाे पदकाे मर्यादा नै थाहा छैन तलाइ बाधेर घासहाल्नु पर्ने ।,1,youtube,"You don't know the extent of your medals, you don't know the extent of your medals, you don't have to trade in jewelry."
yt_560,नेता त सबै चोर छ न यार कोही ले थोरै खान्छ कोहि ले धेरै खान्छन् फरक त्यही हो चोर दलाल हरु साला हो देस त भिखारी पन बनाय छि छि दलाल हरु देस छोड साला दलाल हरु हो ।,0,youtube,"The leader is a thief, and the leader is a man who eats little, and the thief eats much, and the thief is a man who makes a beggar."
yt_1155,भस्ट्र्चार प्रमाणित भए जहा भेटिन्छ कालोमोसो दलेर टिन ठोक्दै बजार घुमाए हुन्छ कानुन ले त करोड खाए को लाई 50 लाख लिएर उन्मुक्ती पाउछन् कानुन को के कुरा गर्ने ।,0,youtube,"When the structure is certified, the market is turned around, and the colomo de la mano is found, knocking on the tin, and the law is passed, and the millions of people who eat it are freed by taking 50 lakhs and talking about the law."
yt_1266,कुलमान जी अगाडि बढ्नुहोला ।,0,youtube,The Khulman went ahead.
yt_314,यो सावित्री को सामाजिक बहिष्कार गरेर गुमनाम गरौ न यो धर्ति की बोझ ।,1,youtube,"This is a social boycott of the Savitrians and an anonymous act, not a burden of devotion."
yt_628,राडि का बान हरु ।,1,youtube,The banners of RADI.
yt_829,यस्ता प्रश्न म लाई नसोध्नु पो भन्छन् कुकुर जस्ता अलिकति पनि नेता को बुद्धि नैतिकता छैन ?,0,youtube,"Don't ask me such questions, but do they say that even a dog like a leader has no intelligence and no morality?"
yt_306,"अस्ती मुनकाे वृयपान पनि नेपालीकाे हीत मा भन्दै थिए अरिङ्गाल हरू अहिले गुठीपनि त्यही भन्दैछन , कृश्यन का भतुवा हरू ।",1,youtube,"Aasti Munka Vryapan also used to say Nepalese hitma and now the Aringals are still saying the same thing, they are Krishna's brother-in-law."
yt_118,सबै पत्रकार ले भन्दिन तर केही पत्रकार ले नेपाली जनता मा भ्रम क छर्ने काम गरे को छ ।,1,youtube,"Not all journalists, but some journalists have done a lot of work to confuse the Nepalese people."
yt_1119,"यी बमवाला पद लोलुप , हत्यारा , आतंककारी हरु ले कि हतियार समर्पण गरेर शान्तिपूर्वक वार्ता मा आउनु पर्छ , होइन भने यिन लाई पनि चाक मा बम लगाएर पड्काउनु पर्छ ।",1,youtube,"These bombers are the post of greedy, murderers, terrorists who must surrender their weapons and enter into peaceful negotiations, otherwise they too must be proven by a bombing of the machinery."
yt_334,एक्दम खुसी भो मन सलाम ।,0,youtube,I am very happy and happy.
yt_207,त डाका हरु को उद्योग बन्द गरे के भो बिदेशी कमपनि धमाधम भित्रीन्छ नि लुटमारा हो ।,0,youtube,Then the post office is shut down and the foreign company is plundered.
yt_1237,यो सोम भतुवा लाइ मिडिया मा नै न लाउनु अब देखि कान्तिपुर tv bhane ko chu ।,1,youtube,Do not bring this to the media now see Kantipur tv bhane ko chu.
yt_442,कुनै पनि जात धर्म लाई असर नपर्ने तरिका को एउ टा एडेन्डा बनाउनुस अनि त्यस्तो एउ टा नया पार्टी निर्माण गर्नुस जनता सबै ले हजुर लाई नै भोट दिनेछन हामि लाई तपाई प्रधानमन्त्री भए को हेर्ने ठूलो सपना छ जय नेपाल जय रबि सर✊✊✊✊ साथै धन्यवाद मदन र क्यानडा नेपाल युनिट लाई ।,0,youtube,Make a common agenda in a way that does not affect any ethnic religion and build a new party like that the people will all vote for you all. We have a great dream to see you become Prime Minister Jai Nepal Jai Rabhi Sir Also thank you Madan and Canada Nepal unit
yt_655,साला नालायक repoter . तँलाइ . भेट्यो भने तेरै माइक थुतेर तेरो मुख फुट्ने गरि बजाउछु साले .. बोल्ने शैलि त थोप्पो नरहेछ गधा को ।,0,youtube,"You're a bad repoter . You're . If you find yourself playing Mike and blowing your mouth off , you're not talking like a donkey ."
yt_1471,गगन थापा नेपाली जनता को आशा भरोसा भए को एक मात्र नेता सडक मा आउनु पर्यो नेपाली काङ्ग्रेस र यो भ्रष्टाचारी दलाल सरकार लाइ ढाल्नु पर्छ ।,1,youtube,The only leader that the Nepali people have ever had confidence in is the Nepali Congress and this corrupt brokerage government.
yt_1328,"हैन , अब फेरी प्रत्येक घर बाट एक एक जना निस्किनै पर्छ ।",0,youtube,"Now, once again, one person must leave each house."
yt_944,वाईडवडी खरीद मा समलग्न भ्रष्टचारी लाई फाँसी दिनु पर्छ ।,1,youtube,Any corrupt person involved in the purchase of the broadway should be hanged.
yt_331,कहिले नरिसाइकन अन्तर्वार्ता लिन सक्ने उत्ते जना भन्दा धैर्यता बढी भए का सालीन व्यक्तित्त्व आदरणीय भूषण दाहाल र स्पष्ट र प्रष्ट वक्ता रवीन्द्र मिश्र को संवाद ले निकै नै प्रभाव पार्‍यो ।,0,youtube,Sometimes being more patient than the person who can be interviewed by a narcissist is more likely to influence the conversation of the respected Bhushan Dahal and the clear and clear speaker Ravindra Misra.
yt_742,यो लालिगुरास सस्था सुरेन्द्र केही पनि श्याम प्रदेशी जस्तै चोर डाका रछ साले यस लाई छोडनु हुन्न दलाल चोर लाई ।,0,youtube,This Laliguras institute Surendra brought nothing like the Shyam Pradesh thief who stole the car and never left it.
yt_286,यो सुर्य पाठक लाई त डाक्टर प्रेम सर ले ठिक पार्नुपर्छ सुशील जी ले चलाए को कार्यक्रम भए को ले हेरियो नत्र त यो पाठक को अनुहार हेर्दा पनि आगो बलेर आउँछ ।,1,youtube,"The Sunny Reader must be corrected by Dr. Prem Sir, who will be directed by Sushil Ji, or the fire will burn when he looks at the reader's face."
yt_1387,रबी जी चितवन को लाखौ जनता हरू लाई life भेंटी सम्बोधन गरनुस ।,0,youtube,Rabi Ji Chetan should address millions of people in the life of the country.
yt_1035,पुण्य को मेरूदण्ड फुस्किने गरि ठोक्नुपर्छ है साथि हो अब ।,0,youtube,"The virtue must be punched in the spine with a blow, my friend."
yt_1308,भिमार्जुन सर लाई विश्वकाे इतिहास हेर्नुस् रे छेउ न धमाला जि चाकरीवाद ले पत्रकारीता नगर्नुहोस् तपाई ले पढ्न जरुरी छ ।,1,youtube,Sir Bharjanjanjan has to look at the history of the world without the darkness of the slave trade and the journalism you need to read.
yt_622,नेपकौ केपि कुकुरलाइ गौलि हानुपरछ कुकुर डाकालाइ ।,0,youtube,Neppaku Kapi Doglai Gauli is a dog named after him.
